{
  "CAND_ID": "",
  "CMTE_CITY": "KANSAS CITY",
  "CMTE_DSGN": "B",
  "CMTE_FILING_FREQ": "M",
  "CMTE_ID": "C00000059",
  "CMTE_NM": "HALLMARK CARDS, INC. PAC (HALLPAC)",
  "CMTE_PTY_AFFILIATION": "UNK",
  "CMTE_ST": "MO",
  "CMTE_ST1": "2501 MCGEE, MD853",
  "CMTE_ST2": "",
  "CMTE_TP": "Q",
  "CMTE_ZIP": "64108",
  "CONNECTED_ORG_NM": "HALLMARK CARDS, INC.",
  "ORG_TP": "C",
  "TRES_NM": "KLEIN, CASSIE MS."
}
