{
  "CAND_ID": "",
  "CMTE_CITY": "WASHINGTON",
  "CMTE_DSGN": "B",
  "CMTE_FILING_FREQ": "M",
  "CMTE_ID": "C00000422",
  "CMTE_NM": "AMERICAN MEDICAL ASSOCIATION POLITICAL ACTION COMMITTEE",
  "CMTE_PTY_AFFILIATION": "",
  "CMTE_ST": "DC",
  "CMTE_ST1": "25 MASSACHUSETTS AVE, NW",
  "CMTE_ST2": "SUITE 600",
  "CMTE_TP": "Q",
  "CMTE_ZIP": "200017400",
  "CONNECTED_ORG_NM": "AMERICAN MEDICAL ASSOCIATION",
  "ORG_TP": "",
  "TRES_NM": "JORDAN, JOHN ROBERT MR."
}
